7,"Greenline Дуб Карамель","доска Greenline Дуб Карамель"
9,"Mazarri Ясень Какао","доска Mazarri Ясень Какао"
8,"Mazarri Ясень Коньяк","доска Mazarri Ясень Коньяк"
10,"Mazarri Ясень Антик","доска Mazarri Ясень Антик"
11,"Mazarri Ясень Песочный","доска Mazarri Ясень Песочный"
12,"Mazarri Дуб Коньяк","доска Mazarri Дуб Коньяк"
13,"Polarwood Дуб Ливинг","доска Polarwood Дуб Ливинг"
14,"Polarwood Ясень Ливинг","доска Polarwood Ясень Ливинг"
15,"Polarwood Дуб Коттедж","доска Polarwood Дуб Коттедж"
16,"Polarwood Дуб Венера","доска Polarwood Дуб Венера"
19,"Upofloor Ясень Кантри Marble Matt МЛБ 3-полосный 3,41м2/уп.","доска Upofloor Ясень Кантри Marble Matt МЛБ 3-полосный 3,41м2/уп."
21,"Upofloor Дуб Classic Brown СЛ 3,41 м2/уп 3-полосный","доска Upofloor Дуб Classic Brown СЛ 3,41 м2/уп 3-полосный"
22,"Upofloor Дуб Silver СЛ 3-полосный 3,41м2/уп","доска Upofloor Дуб Silver СЛ 3-полосный 3,41м2/уп"
23,"Amber Wood Ясень Миндаль","доска Amber Wood Ясень Миндаль"
24,"Amber Wood Ясень Бурбон","доска Amber Wood Ясень Бурбон"
25,"Amber Wood Ясень Махагон","доска Amber Wood Ясень Махагон"
26,"Amber Wood Ясень Шампань","доска Amber Wood Ясень Шампань"
27,"Amber Wood Ясень Слоновая кость","доска Amber Wood Ясень Слоновая кость"
28,"Baum Дуб Карамель","доска Baum Дуб Карамель"
29,"Baum Дуб Кофе","доска Baum Дуб Кофе"
30,"Baum Дуб Селект","доска Baum Дуб Селект"
31,"Baum Ясень Барокко","доска Baum Ясень Барокко"
32,"Baum Ясень Сахара","доска Baum Ясень Сахара"
33,"Esta Parket Ясень Antique","доска Esta Parket Ясень Antique"
34,"Esta Parket Дуб Village(natur)","доска Esta Parket Дуб Village(natur)"
35,"Esta Parket Ясень Brendy","доска Esta Parket Ясень Brendy"
36,"Esta Parket Ясень Honey","доска Esta Parket Ясень Honey"
37,"Esta Parket Ясень Rose","доска Esta Parket Ясень Rose"
38,"FocusFloor Дуб Либецио (LIBECCIO)","доска FocusFloor Дуб Либецио (LIBECCIO)"
39,"FocusFloor Дуб Хамсин (KHAMSIN)","доска FocusFloor Дуб Хамсин (KHAMSIN)"
40,"FocusFloor Дуб Лодос (LODOS)","доска FocusFloor Дуб Лодос (LODOS)"
41,"FocusFloor Дуб Сирокко (SIROCCO)","доска FocusFloor Дуб Сирокко (SIROCCO)"
42,"FocusFloor Ясень Мистраль (MISTRAL)","доска FocusFloor Ясень Мистраль (MISTRAL)"
43,"Barlinek Дуб Berlin","доска Barlinek Дуб Berlin"
44,"Barlinek Ясень Munchen","доска Barlinek Ясень Munchen"
45,"Barlinek Дуб Goldberg","доска Barlinek Дуб Goldberg"
46,"Barlinek Ясень Frankfurt","доска Barlinek Ясень Frankfurt"
47,"Barlinek Ясень Saimaa","доска Barlinek Ясень Saimaa"
48,"Karelia Дуб Natural","доска Karelia Дуб Natural"
49,"Karelia Ясень Country Vanilla Matt","доска Karelia Ясень Country Vanilla Matt"
50,"Karelia Дуб Rock Salt","доска Karelia Дуб Rock Salt"
51,"Karelia Дуб Oregano","доска Karelia Дуб Oregano"
52,"Karelia Дуб Darc Chocolate","доска Karelia Дуб Darc Chocolate"
53,"Ellett Ясень Super White","доска Ellett Ясень Super White"
54,"Ellett Дуб Grey","доска Ellett Дуб Grey"
55,"Ellett Ясень Select Super White","доска Ellett Ясень Select Super White"
56,"Ellett Вяз Elm Red","доска Ellett Вяз Elm Red"
57,"Ellett Вяз Elm Red","доска Ellett Вяз Elm Red"
58,"Wood Bee Дуб Антик Блэк Стори","доска Wood Bee Дуб Антик Блэк Стори"
59,"Wood Bee Бамбук Кофе","доска Wood Bee Бамбук Кофе"
60,"Wood Bee Бамбук Натур","доска Wood Bee Бамбук Натур"
61,"Wood Bee Дуб Вулканик","доска Wood Bee Дуб Вулканик"
62,"Wood Bee Дуб натур Браш","доска Wood Bee Дуб натур Браш"
63,"Boen-Hohns Дуб Cottage","доска Boen-Hohns Дуб Cottage"
64,"Boen-Hohns Ясень Palace","доска Boen-Hohns Ясень Palace"
65,"Boen-Hohns Дуб Ganstock","доска Boen-Hohns Дуб Ganstock"
66,"Boen-Hohns Дуб Cocoa","доска Boen-Hohns Дуб Cocoa"
67,"Boen-Hohns Дуб Metropole","доска Boen-Hohns Дуб Metropole"
68,"Coswick Дуб Французский гобелен / French Gobelin","доска Coswick Дуб Французский гобелен / French Gobelin"
69,"Coswick Дуб Ванильный","доска Coswick Дуб Ванильный"
70,"Coswick Дуб Антик белый (Antique white)","доска Coswick Дуб Антик белый (Antique white)"
71,"Coswick Ясень Аваланж (Avalanche)","доска Coswick Ясень Аваланж (Avalanche)"
72,"Coswick Дуб Орех","доска Coswick Дуб Орех"
73,"Kahrs Дуб Прилив натуральное масло браш (Лодж)","доска Kahrs Дуб Прилив натуральное масло браш (Лодж)"
74,"Kahrs Дуб Прилив матовый лак (Лодж)","доска Kahrs Дуб Прилив матовый лак (Лодж)"
75,"Kahrs Дуб Бриз сатиновый лак (Лодж)","доска Kahrs Дуб Бриз сатиновый лак (Лодж)"
76,"Kahrs Дуб Бриз матовый лак (Лодж)","доска Kahrs Дуб Бриз матовый лак (Лодж)"
77,"Kahrs Орех Дождь (Лодж)","доска Kahrs Орех Дождь (Лодж)"
79,"Universal Гевея Прайм красная","доска Universal Гевея Прайм красная"
80,"Universal Дуб Прайм","доска Universal Дуб Прайм"
81,"Universal Дуб Прайм Мраморный","доска Universal Дуб Прайм Мраморный"
82,"Universal Дуб прайм термо","доска Universal Дуб прайм термо"
83,"Timberwise Дуб Alaska масло","доска Timberwise Дуб Alaska масло"
84,"Timberwise Дуб Adriatic масло","доска Timberwise Дуб Adriatic масло"
85,"Timberwise Дуб Bering","доска Timberwise Дуб Bering"
86,"Timberwise Дуб Carbon White","доска Timberwise Дуб Carbon White"
87,"Timberwise Дуб Choco 50%","доска Timberwise Дуб Choco 50%"
88,"Old Wood Дуб Шоколад рустик","доска Old Wood Дуб Шоколад рустик"
89,"Old Wood Дуб Натуральный","доска Old Wood Дуб Натуральный"
90,"Old Wood Ясень Крем белый","доска Old Wood Ясень Крем белый"
91,"Old Wood Ясень Шоколад ТЕРМО","доска Old Wood Ясень Шоколад ТЕРМО"
92,"Old Wood Дуб Карамель","доска Old Wood Дуб Карамель"
93,"Grabo Дуб Примо","доска Grabo Дуб Примо"
94,"Grabo Ясень Тренд","доска Grabo Ясень Тренд"
95,"Grabo Дуб Натур","доска Grabo Дуб Натур"
96,"Grabo Дуб Рустик","доска Grabo Дуб Рустик"
97,"Grabo Ясень Тренд белый лак","доска Grabo Ясень Тренд белый лак"
98,"Par-Ky Дуб европейский brushed PB101","доска Par-Ky Дуб европейский brushed PB101"
99,"Par-Ky Дуб Ivory brushed PB102","доска Par-Ky Дуб Ivory brushed PB102"
100,"Par-Ky Дуб Milk brushed PB103","доска Par-Ky Дуб Milk brushed PB103"
101,"Par-Ky Дуб Desert brushed  PB104","доска Par-Ky Дуб Desert brushed  PB104"
102,"Par-Ky Дуб Mystery brushed PB105","доска Par-Ky Дуб Mystery brushed PB105"
103,"Panaget Французский Дуб Гранит","доска Panaget Французский Дуб Гранит"
104,"Panaget Орех американский","доска Panaget Орех американский"
105,"Panaget Французский дуб Топия","доска Panaget Французский дуб Топия"
106,"Panaget Французский дуб Салина","доска Panaget Французский дуб Салина"
107,"Panaget Французский дуб Слива","доска Panaget Французский дуб Слива"
108,"Weitzer Дуб Миндаль","доска Weitzer Дуб Миндаль"
109,"Weitzer Дуб Гавана","доска Weitzer Дуб Гавана"
110,"Weitzer Дуб Трюфель","доска Weitzer Дуб Трюфель"
111,"Weitzer Дуб Кашемир","доска Weitzer Дуб Кашемир"
112,"Weitzer Дуб Айс","доска Weitzer Дуб Айс"
113,"Дуб арт.77-01","доска  Дуб арт.77-01"
114,"Mazarri Дуб арт.77-02","доска Mazarri Дуб арт.77-02"
115,"Mazarri Дуб арт.77-04","доска Mazarri Дуб арт.77-04"
116,"Mazarri Дуб арт.77-05","доска Mazarri Дуб арт.77-05"
117,"Mazarri Дуб арт.77-06","доска Mazarri Дуб арт.77-06"
118,"Siberian Floor Дуб Априкот, лак УФ","доска Siberian Floor Дуб Априкот, лак УФ"
119,"Siberian Floor Дуб Эбенхольц, масло УФ","доска Siberian Floor Дуб Эбенхольц, масло УФ"
120,"Siberian Floor Дуб Белый, масло УФ","доска Siberian Floor Дуб Белый, масло УФ"
121,"Siberian Floor Дуб Антик, масло УФ","доска Siberian Floor Дуб Антик, масло УФ"
122,"Siberian Floor Дуб Платина, лак УФ","доска Siberian Floor Дуб Платина, лак УФ"
123,"Greenline Дуб Леон","доска Greenline Дуб Леон"
124,"Greenline Дуб Майорка","доска Greenline Дуб Майорка"
125,"Greenline Дуб Севилья","доска Greenline Дуб Севилья"
126,"Greenline Дуб Верона","доска Greenline Дуб Верона"
127,"Greenline Дуб Венеция","доска Greenline Дуб Венеция"
128,"Global Parquet Дуб Plum (Слива)","доска Global Parquet Дуб Plum (Слива)"
129,"Global Parquet Дуб Cream Currant (Смородина)","доска Global Parquet Дуб Cream Currant (Смородина)"
130,"Global Parquet Дуб Pine Nut (Кедровый)","доска Global Parquet Дуб Pine Nut (Кедровый)"
131,"Global Parquet Дуб Peach (Персик)","доска Global Parquet Дуб Peach (Персик)"
132,"Global Parquet Дуб Raisins (Изюм)","доска Global Parquet Дуб Raisins (Изюм)"
133,"Bauwerk Дуб Duna","доска Bauwerk Дуб Duna"
134,"Bauwerk Дуб Sasso","доска Bauwerk Дуб Sasso"
135,"Bauwerk Дуб Farina","доска Bauwerk Дуб Farina"
136,"Bauwerk Дуб","доска Bauwerk Дуб"
137,"Bauwerk Дуб копчёный","доска Bauwerk Дуб копчёный"
138,"Mercier Канадский Твердый Клен Арабика","доска Mercier Канадский Твердый Клен Арабика"
139,"Mercier Канадский Твердый Клен Шоколадный","доска Mercier Канадский Твердый Клен Шоколадный"
140,"Mercier Канадский Твердый Клен Затмение","доска Mercier Канадский Твердый Клен Затмение"
141,"Mercier Канадский Твердый Клен Каменно-Коричневый","доска Mercier Канадский Твердый Клен Каменно-Коричневый"
142,"Mercier Канадский Твердый Клен Корица","доска Mercier Канадский Твердый Клен Корица"
143,"Missouri Collection Орех Американский натур(16х140)","доска Missouri Collection Орех Американский натур(16х140)"
144,"Missouri Collection Орех Американский натур(16х190)","доска Missouri Collection Орех Американский натур(16х190)"
145,"Missouri Collection Орех Американский селект(16х140)","доска Missouri Collection Орех Американский селект(16х140)"
146,"Missouri Collection Орех Американский селект(16х190)","доска Missouri Collection Орех Американский селект(16х190)"
147,"Coswick Дуб  Антик белый / Antique white Кантри","доска Coswick Дуб  Антик белый / Antique white Кантри"
148,"Coswick Дуб Терракота / Terracotta Кантри","доска Coswick Дуб Терракота / Terracotta Кантри"
149,"Coswick Дуб  Френч Эстейт / French Estate Кантри","доска Coswick Дуб  Френч Эстейт / French Estate Кантри"
150,"Coswick Дуб Тёмный Шоколад / Dark chocolate","доска Coswick Дуб Тёмный Шоколад / Dark chocolate"
151,"Coswick Дуб Бразильский орех / Walnut Кантри","доска Coswick Дуб Бразильский орех / Walnut Кантри"
152,"Boen-Hohns Дуб Traditional","доска Boen-Hohns Дуб Traditional"
153,"Boen-Hohns Дуб Traditional белый","доска Boen-Hohns Дуб Traditional белый"
154,"Boen-Hohns Дуб Pearl","доска Boen-Hohns Дуб Pearl"
155,"Boen-Hohns Дуб Antique","доска Boen-Hohns Дуб Antique"
156,"Boen-Hohns Дуб Stonewashed Old grey","доска Boen-Hohns Дуб Stonewashed Old grey"
157,"Дуб Pilatus","доска  Дуб Pilatus"
158,"Дуб Oste","доска  Дуб Oste"
159,"Дуб Santis","доска  Дуб Santis"
160,"Дуб Rhein","доска  Дуб Rhein"
161,"Дуб Monte Rosa","доска  Дуб Monte Rosa"
162,"Progress Сахара","доска Progress Сахара"
163,"Progress Британия","доска Progress Британия"
164,"Progress Церматт","доска Progress Церматт"
165,"Progress Дюфур (ясень)","доска Progress Дюфур (ясень)"
166,"Progress Эльм","доска Progress Эльм"
167,"Mazarri Верона темный","доска Mazarri Верона темный"
168,"Mazarri Гордон темный","доска Mazarri Гордон темный"
169,"Mazarri Верона Эстато","доска Mazarri Верона Эстато"
170,"Mazarri Верона светлый","доска Mazarri Верона светлый"
171,"Mazarri Верона Пулито","доска Mazarri Верона Пулито"
172,"Bolefloor Дуб без покрытия","доска Bolefloor Дуб без покрытия"
173,"Bolefloor Дуб","доска Bolefloor Дуб"
174,"Bolefloor Дуб","доска Bolefloor Дуб"
175,"Bolefloor Дуб","доска Bolefloor Дуб"
176,"Doms Lack","доска Doms Lack"
177,"Doms Grey","доска Doms Grey"
178,"Doms Vagnila","доска Doms Vagnila"
179,"Doms Noce","доска Doms Noce"
180,"Doms Nougat","доска Doms Nougat"
181,"Wood Bee Дуб Натур Браш","доска Wood Bee Дуб Натур Браш"
182,"Wood Bee Дуб Коньяк","доска Wood Bee Дуб Коньяк"
183,"Wood Bee Ясень Коньяк","доска Wood Bee Ясень Коньяк"
184,"Wood Bee Дуб Селект","доска Wood Bee Дуб Селект"
185,"Wood Bee Дуб Вайт","доска Wood Bee Дуб Вайт"
191,"Tavolini Floors Дуб Натуральный","доска Tavolini Floors Дуб Натуральный"
186,"Louvre Орех Американский","елка Louvre Орех Американский"
193,"Tavolini Floors Дуб Siena","доска Tavolini Floors Дуб Siena"
194,"Tavolini Floors Дуб Elba","доска Tavolini Floors Дуб Elba"
195,"Tavolini Floors Дуб Lido","доска Tavolini Floors Дуб Lido"
197,"Mazarri Дуб Натуральный","доска Mazarri Дуб Натуральный"
196,"Дуб Натур","доска  Дуб Натур"
198,"Mazarri Дуб Ноче Олд","доска Mazarri Дуб Ноче Олд"
199,"Mazarri Дуб Марроне","доска Mazarri Дуб Марроне"
200,"Mazarri Дуб Морденте","доска Mazarri Дуб Морденте"
201,"Greenline Дуб Милан","доска Greenline Дуб Милан"
202,"Greenline Дуб Мурано","доска Greenline Дуб Мурано"
203,"Greenline Дуб Флоренция","доска Greenline Дуб Флоренция"
204,"Greenline Дуб Тоскано","доска Greenline Дуб Тоскано"
205,"Greenline Дуб Кьянти","доска Greenline Дуб Кьянти"
206,"Mazarri Дуб Термо","доска Mazarri Дуб Термо"
207,"Термоясень - Gold","доска  Термоясень - Gold"
208,"Термоясень - Moon","доска  Термоясень - Moon"
209,"Термоясень - Natural","доска  Термоясень - Natural"
210,"Термоясень - Snow","доска  Термоясень - Snow"
211,"Дуб натуральный сортировка Рустик без сучков","доска  Дуб натуральный сортировка Рустик без сучков"
212,"Дуб натуральный сортировка Рустик","доска  Дуб натуральный сортировка Рустик"
213,"Дуб натуральный 16мм","доска  Дуб натуральный 16мм"
214,"Дуб натуральный сортировка Натур","доска  Дуб натуральный сортировка Натур"
216,"Coswick Дуб Молочный шоколад","доска Coswick Дуб Молочный шоколад"
217,"Coswick Ясень Мокка / Mocca","доска Coswick Ясень Мокка / Mocca"
218,"Coswick Дуб Янтарный / Amber","доска Coswick Дуб Янтарный / Amber"
219,"Coswick Дуб Натуральный / Natural, коммон","доска Coswick Дуб Натуральный / Natural, коммон"
220,"Coswick Дуб Мускат / Muscat","доска Coswick Дуб Мускат / Muscat"
221,"Boen-Hohns Дуб Traditional","доска Boen-Hohns Дуб Traditional"
222,"Boen-Hohns Дуб Traditional белый","доска Boen-Hohns Дуб Traditional белый"
223,"Boen-Hohns Дуб Stonewashed Old grey","доска Boen-Hohns Дуб Stonewashed Old grey"
224,"Boen-Hohns Дуб Antique","доска Boen-Hohns Дуб Antique"
225,"Boen-Hohns Дуб Highland","доска Boen-Hohns Дуб Highland"
226,"Progress Сахара","доска Progress Сахара"
227,"Progress Британия","доска Progress Британия"
228,"Progress Церматт","доска Progress Церматт"
229,"Progress Дюфур (ясень)","доска Progress Дюфур (ясень)"
230,"Progress Эльм","доска Progress Эльм"
231,"Лара (Че)","доска  Лара (Че)"
232,"Палисандр Селект","доска  Палисандр Селект"
233,"Мербау L","доска  Мербау L"
234,"Мербау M","доска  Мербау M"
235,"Мербау D","доска  Мербау D"
236,"Mercier Дуб Красный медовый","доска Mercier Дуб Красный медовый"
237,"Mercier Канадский Твердый Клен темно-коричневый","доска Mercier Канадский Твердый Клен темно-коричневый"
238,"Mercier Дуб Красный  Умеренно-коричневый","доска Mercier Дуб Красный  Умеренно-коричневый"
239,"Mercier Дуб Красный Графит Эритаж","доска Mercier Дуб Красный Графит Эритаж"
240,"Mercier Дуб Красный Шоколад Эритаж","доска Mercier Дуб Красный Шоколад Эритаж"
241,"Amigo Бамбук Кофе горизонтальный","доска Amigo Бамбук Кофе горизонтальный"
242,"Amigo Дуб Натур","доска Amigo Дуб Натур"
243,"Amigo Дуб Табако","доска Amigo Дуб Табако"
244,"Amigo Дуб Лазурный берег","доска Amigo Дуб Лазурный берег"
245,"Amigo Дуб Карамель","доска Amigo Дуб Карамель"
246,"Komodoor Мербау","доска Komodoor Мербау"
247,"Komodoor Кемпас","доска Komodoor Кемпас"
248,"Komodoor Мербау клееный массив","доска Komodoor Мербау клееный массив"
249,"Komodoor Кемпас Клееный массив","доска Komodoor Кемпас Клееный массив"
250,"Komodoor Ормозия","доска Komodoor Ормозия"
251,"Jackson Flooring Натур","доска Jackson Flooring Натур"
252,"Jackson Flooring Кофе","доска Jackson Flooring Кофе"
253,"Jackson Flooring Черное золото","доска Jackson Flooring Черное золото"
254,"Jackson Flooring Темный ром","доска Jackson Flooring Темный ром"
255,"Jackson Flooring Каменная волна","доска Jackson Flooring Каменная волна"
256,"Ribadao Ироко","доска Ribadao Ироко"
257,"Ribadao Тигровое дерево","доска Ribadao Тигровое дерево"
258,"Ribadao Ятоба","доска Ribadao Ятоба"
259,"Ribadao Боссе","доска Ribadao Боссе"
260,"Ribadao Сукупира","доска Ribadao Сукупира"
261,"Missouri Collection Кумару","доска Missouri Collection Кумару"
262,"Missouri Collection Сукупира","доска Missouri Collection Сукупира"
263,"Missouri Collection Палисандр","доска Missouri Collection Палисандр"
264,"Missouri Collection Caffe. Дуб американский с карбонизированной обработкой","доска Missouri Collection Caffe. Дуб американский с карбонизированной обработкой"
265,"Missouri Collection Clou. Дуб американский с карбонизированной обработкой","доска Missouri Collection Clou. Дуб американский с карбонизированной обработкой"
266,"Inpa Ибираро (Парагвайский орех)","доска Inpa Ибираро (Парагвайский орех)"
268,"Inpa Лапачо (Ипе)","доска Inpa Лапачо (Ипе)"
269,"Inpa Курупау (Патагонский палисандр)","доска Inpa Курупау (Патагонский палисандр)"
270,"Inpa Сото (Парагвайский палисандр)","доска Inpa Сото (Парагвайский палисандр)"
267,"Inpa Ятоба (Бразильская вишня)","доска Inpa Ятоба (Бразильская вишня)"
271,"Magestik Floor Бамбук Натур","доска Magestik Floor Бамбук Натур"
272,"Magestik Floor Бамбук Кофе","доска Magestik Floor Бамбук Кофе"
273,"Magestik Floor Кемпас","доска Magestik Floor Кемпас"
274,"Magestik Floor Каслин Орех","доска Magestik Floor Каслин Орех"
275,"Magestik Floor Береза Черная","доска Magestik Floor Береза Черная"
276,"Amber Wood Дуб Белый 18х120х300-1800","доска Amber Wood Дуб Белый 18х120х300-1800"
277,"Amber Wood Ясень Белый","доска Amber Wood Ясень Белый"
278,"Amber Wood Ясень Светлый орех","доска Amber Wood Ясень Светлый орех"
279,"Amber Wood Ясень кофе 18х120х300-1800","доска Amber Wood Ясень кофе 18х120х300-1800"
280,"Amber Wood Ясень Шоколад","доска Amber Wood Ясень Шоколад"
281,"Sherwood Мербау (Среднее)","доска Sherwood Мербау (Среднее)"
282,"Sherwood Клен европейский","доска Sherwood Клен европейский"
283,"Sherwood Ятоба","доска Sherwood Ятоба"
284,"Sherwood Грецкий орех","доска Sherwood Грецкий орех"
285,"Sherwood Мироксилон","доска Sherwood Мироксилон"
286,"Bolefloor дуб рустик","доска Bolefloor дуб рустик"
287,"Bolefloor клен","доска Bolefloor клен"
288,"Bolefloor ясень натур","доска Bolefloor ясень натур"
289,"Bolefloor дуб натур","доска Bolefloor дуб натур"
290,"Bolefloor ясень селект","доска Bolefloor ясень селект"
291,"Tavolini Floors Дуб Натуральный","доска Tavolini Floors Дуб Натуральный"
292,"Tavolini Floors Дуб Etna","доска Tavolini Floors Дуб Etna"
293,"Tavolini Floors Дуб Monaco","доска Tavolini Floors Дуб Monaco"
294,"Tavolini Floors Дуб Dante","доска Tavolini Floors Дуб Dante"
295,"Tavolini Floors Дуб Bruno","доска Tavolini Floors Дуб Bruno"
298,"Berthold Дуб европейский маркант","доска Berthold Дуб европейский маркант"
