1402,"Mazarri Дуб Песочный 2-пол.","доска Mazarri Дуб Песочный 2-пол."
1404,"Polarwood Ясень Плутон","доска Polarwood Ясень Плутон"
1403,"Mazarri Орех Американский","доска Mazarri Орех Американский"
1405,"Polarwood Ясень Сатурн","доска Polarwood Ясень Сатурн"
1406,"Polarwood Ясень Луна","доска Polarwood Ясень Луна"
1407,"Polarwood Ясень Марс","доска Polarwood Ясень Марс"
1408,"Polarwood Дуб Уран","доска Polarwood Дуб Уран"
1409,"Polarwood Дуб Нептун","доска Polarwood Дуб Нептун"
1410,"Polarwood Дуб Кальвадос","доска Polarwood Дуб Кальвадос"
1411,"Polarwood Дуб Юпитер","доска Polarwood Дуб Юпитер"
1412,"Polarwood Дуб Дарк Браун","доска Polarwood Дуб Дарк Браун"
1413,"Polarwood Дуб Тундра беленый","доска Polarwood Дуб Тундра беленый"
1414,"Polarwood Дуб Коттедж","доска Polarwood Дуб Коттедж"
1415,"Polarwood Дуб Меркурий","доска Polarwood Дуб Меркурий"
1416,"Polarwood Дуб Орегон","доска Polarwood Дуб Орегон"
1417,"Polarwood Дуб Купидон","доска Polarwood Дуб Купидон"
1419,"Polarwood Дуб Элара","доска Polarwood Дуб Элара"
1418,"Polarwood Дуб Протей","доска Polarwood Дуб Протей"
1420,"Polarwood Дуб Карме","доска Polarwood Дуб Карме"
1421,"Upofloor Дуб Granite  СЛ 3-полосный 3,41м2/уп","доска Upofloor Дуб Granite  СЛ 3-полосный 3,41м2/уп"
1422,"Upofloor Дуб Венге СЛ 3,41м2/уп 3-полосный","доска Upofloor Дуб Венге СЛ 3,41м2/уп 3-полосный"
1423,"Upofloor Дуб Select  СЛ 3,41 м2/уп","доска Upofloor Дуб Select  СЛ 3,41 м2/уп"
1424,"Upofloor Ясень Натур 3-полосный СЛ 3,41м2/уп.","доска Upofloor Ясень Натур 3-полосный СЛ 3,41м2/уп."
1426,"Upofloor Дуб Мокка  НМЦ/Б 3,41м2уп. 3-полосный","доска Upofloor Дуб Мокка  НМЦ/Б 3,41м2уп. 3-полосный"
1427,"Upofloor Ясень Натур  Marble Matt МЛБ 3-полосный 3,41м2/уп.","доска Upofloor Ясень Натур  Marble Matt МЛБ 3-полосный 3,41м2/уп."
1428,"Upofloor Дуб Селект White Oiled НМБ 3-полосный","доска Upofloor Дуб Селект White Oiled НМБ 3-полосный"
1430,"Upofloor Дуб Селект OILED 3-полосный 3,41м2/уп","доска Upofloor Дуб Селект OILED 3-полосный 3,41м2/уп"
1429,"Upofloor Дуб Селект Marble Matt  3-полосный МЛБ 3,41м2/уп.","доска Upofloor Дуб Селект Marble Matt  3-полосный МЛБ 3,41м2/уп."
1431,"Upofloor Дуб CAPPUCINO 3-полосный НМЦ/Б 3,41м2/уп","доска Upofloor Дуб CAPPUCINO 3-полосный НМЦ/Б 3,41м2/уп"
1432,"Upofloor Дуб White Marble СЛ","доска Upofloor Дуб White Marble СЛ"
1433,"Upofloor Дуб  Thunder Cloud НМБ/Б","доска Upofloor Дуб  Thunder Cloud НМБ/Б"
1434,"Upofloor Дуб Silver Mist НМЦ/Б","доска Upofloor Дуб Silver Mist НМЦ/Б"
1435,"Upofloor Дуб Frost НМЦ/Б","доска Upofloor Дуб Frost НМЦ/Б"
1436,"Upofloor Мербау СЛ 3,41м2/уп. 3-полосный","доска Upofloor Мербау СЛ 3,41м2/уп. 3-полосный"
1437,"Upofloor Дуб Кантри СЛ 2,2м2/уп 1-полосный","доска Upofloor Дуб Кантри СЛ 2,2м2/уп 1-полосный"
1438,"Upofloor Дуб  Натур СЛ 1-полосный 2,0/2,2м2/уп","доска Upofloor Дуб  Натур СЛ 1-полосный 2,0/2,2м2/уп"
1439,"Amber Wood Ясень Капучино","доска Amber Wood Ясень Капучино"
1440,"Amber Wood Ясень Натур лак","доска Amber Wood Ясень Натур лак"
1441,"Amber Wood Ясень Селект лак","доска Amber Wood Ясень Селект лак"
1442,"Amber Wood Ясень Коньяк","доска Amber Wood Ясень Коньяк"
1443,"Amber Wood Дуб Миндаль","доска Amber Wood Дуб Миндаль"
1444,"Amber Wood Ясень Жемчужный","доска Amber Wood Ясень Жемчужный"
1445,"Amber Wood Дуб Бурбон","доска Amber Wood Дуб Бурбон"
1446,"Amber Wood Дуб Махагон","доска Amber Wood Дуб Махагон"
1447,"Amber Wood Дуб Мускат","доска Amber Wood Дуб Мускат"
1449,"Amber Wood Дуб Шампань","доска Amber Wood Дуб Шампань"
1450,"Amber Wood Дуб Слоновая кость","доска Amber Wood Дуб Слоновая кость"
1451,"Amber Wood Дуб Капучино","доска Amber Wood Дуб Капучино"
1452,"Amber Wood Ясень Натур лак","доска Amber Wood Ясень Натур лак"
1453,"Amber Wood Ясень Шоколад","доска Amber Wood Ясень Шоколад"
1454,"Amber Wood Ясень кофе","доска Amber Wood Ясень кофе"
1455,"Amber Wood Ясень Натур браш масло","доска Amber Wood Ясень Натур браш масло"
1456,"Amber Wood Дуб Экстра","доска Amber Wood Дуб Экстра"
1457,"Amber Wood Ясень Селект","доска Amber Wood Ясень Селект"
1458,"Baum Дуб Жемчуг","доска Baum Дуб Жемчуг"
1459,"Baum Дуб Шелк Браш","доска Baum Дуб Шелк Браш"
1460,"Baum Ясень Арктик","доска Baum Ясень Арктик"
1461,"Baum Дуб Копченый белый","доска Baum Дуб Копченый белый"
1462,"Baum Дуб Серебро","доска Baum Дуб Серебро"
1463,"Esta Parket Ясень Chestnut","доска Esta Parket Ясень Chestnut"
1464,"Esta Parket Ясень Village White","доска Esta Parket Ясень Village White"
1465,"Esta Parket Ясень Village","доска Esta Parket Ясень Village"
1466,"Esta Parket Дуб Town(natur-select)","доска Esta Parket Дуб Town(natur-select)"
1467,"Esta Parket Дуб Antique","доска Esta Parket Дуб Antique"
1468,"Esta Parket Дуб Ebony Brush","доска Esta Parket Дуб Ebony Brush"
1469,"Esta Parket Бук Shoko","доска Esta Parket Бук Shoko"
1470,"Esta Parket Дуб Village White (natur-white)","доска Esta Parket Дуб Village White (natur-white)"
1471,"Esta Parket Ясень Amaretto Natural Pores Brush","доска Esta Parket Ясень Amaretto Natural Pores Brush"
1472,"Esta Parket Дуб Dusky Grey Brush","доска Esta Parket Дуб Dusky Grey Brush"
1473,"Esta Parket Ясень Elite White (select white)","доска Esta Parket Ясень Elite White (select white)"
1474,"Esta Parket Дуб Bitter Brush","доска Esta Parket Дуб Bitter Brush"
1476,"Esta Parket Дуб Dune White Pores Brush","доска Esta Parket Дуб Dune White Pores Brush"
1475,"Esta Parket Дуб Antracite","доска Esta Parket Дуб Antracite"
1477,"Esta Parket Дуб Ebony Pores","доска Esta Parket Дуб Ebony Pores"
1478,"Esta Parket Дуб Antique  UV-Oil","доска Esta Parket Дуб Antique  UV-Oil"
1479,"Esta Parket Дуб City (select-radial)","доска Esta Parket Дуб City (select-radial)"
1480,"Esta Parket Дуб Rose Ebony Pores Brush","доска Esta Parket Дуб Rose Ebony Pores Brush"
1481,"Esta Parket Дуб Quartz White Pores","доска Esta Parket Дуб Quartz White Pores"
1482,"FocusFloor Дуб Леванте (LEVANTE)","доска FocusFloor Дуб Леванте (LEVANTE)"
1483,"FocusFloor Ясень Грегал (GREGALE)","доска FocusFloor Ясень Грегал (GREGALE)"
1484,"FocusFloor Ясень Техуано (TEHUANO)","доска FocusFloor Ясень Техуано (TEHUANO)"
1486,"FocusFloor Ясень Памперо (PAMPERO)","доска FocusFloor Ясень Памперо (PAMPERO)"
1485,"FocusFloor Ясень Байамо (BAYAMO)","доска FocusFloor Ясень Байамо (BAYAMO)"
1487,"FocusFloor Дуб Бора (BORA)","доска FocusFloor Дуб Бора (BORA)"
1488,"FocusFloor Дуб Калима (CALIMA)","доска FocusFloor Дуб Калима (CALIMA)"
1489,"FocusFloor Дуб Пониенте (PONIENTE)","доска FocusFloor Дуб Пониенте (PONIENTE)"
1491,"FocusFloor Дуб Трамонтана (TRAMONTANA)","доска FocusFloor Дуб Трамонтана (TRAMONTANA)"
1490,"FocusFloor Дуб Санта-Ана (SANTA ANA)","доска FocusFloor Дуб Санта-Ана (SANTA ANA)"
1492,"FocusFloor Дуб Остро (OSTRO)","доска FocusFloor Дуб Остро (OSTRO)"
1493,"FocusFloor Дуб Хамсин (KHAMSIN) 1800","доска FocusFloor Дуб Хамсин (KHAMSIN) 1800"
1494,"FocusFloor Дуб Калима (CALIMA)","доска FocusFloor Дуб Калима (CALIMA)"
1496,"FocusFloor Дуб Шамаль (SHAMAL) 1800","доска FocusFloor Дуб Шамаль (SHAMAL) 1800"
1495,"FocusFloor Дуб Леванте (LEVANTE) 1800","доска FocusFloor Дуб Леванте (LEVANTE) 1800"
1497,"FocusFloor Дуб Эйлиз (ALIZE) 1800","доска FocusFloor Дуб Эйлиз (ALIZE) 1800"
1498,"FocusFloor Дуб Этеcиан (ETESIAN) 1800","доска FocusFloor Дуб Этеcиан (ETESIAN) 1800"
1499,"FocusFloor Дуб Бора (BORA) 1800","доска FocusFloor Дуб Бора (BORA) 1800"
1500,"Barlinek Дуб Bianco","доска Barlinek Дуб Bianco"
1501,"Barlinek Дуб Aurora","доска Barlinek Дуб Aurora"
1502,"Barlinek Дуб Amazon","доска Barlinek Дуб Amazon"
1503,"Barlinek Дуб Mocca","доска Barlinek Дуб Mocca"
1504,"Barlinek Дуб Honey","доска Barlinek Дуб Honey"
1505,"Barlinek Дуб Espresso","доска Barlinek Дуб Espresso"
1506,"Barlinek Ясень Coffee (Кофе)","доска Barlinek Ясень Coffee (Кофе)"
1507,"Barlinek Дуб Tiramisu","доска Barlinek Дуб Tiramisu"
1508,"Barlinek Дуб Banana Song","доска Barlinek Дуб Banana Song"
1509,"Barlinek Дуб Marzipan Muffin","доска Barlinek Дуб Marzipan Muffin"
1510,"Barlinek Дуб Cappucino","доска Barlinek Дуб Cappucino"
1511,"Barlinek Ясень Saimaa Piccolo","доска Barlinek Ясень Saimaa Piccolo"
1512,"Barlinek Дуб Ascania Piccolo","доска Barlinek Дуб Ascania Piccolo"
1513,"Barlinek Тали Sipadan","доска Barlinek Тали Sipadan"
1514,"Barlinek Сапелли (Сапела) Uluru","доска Barlinek Сапелли (Сапела) Uluru"
1516,"Karelia Дуб Curry","доска Karelia Дуб Curry"
1515,"Karelia Дуб Black Pepper","доска Karelia Дуб Black Pepper"
1517,"Karelia Дуб Cinnamon","доска Karelia Дуб Cinnamon"
1518,"Karelia Дуб Antique","доска Karelia Дуб Antique"
1519,"Karelia Дуб Select","доска Karelia Дуб Select"
1520,"Karelia Дуб Ivory Stonewashed","доска Karelia Дуб Ivory Stonewashed"
1521,"Karelia Дуб Stonewashed Ebony","доска Karelia Дуб Stonewashed Ebony"
1522,"Karelia Ясень Natur","доска Karelia Ясень Natur"
1523,"Karelia Дуб Select Vanilla Matt","доска Karelia Дуб Select Vanilla Matt"
1524,"Karelia Дуб Select New Arctic","доска Karelia Дуб Select New Arctic"
1525,"Karelia Дуб Select Silky","доска Karelia Дуб Select Silky"
1526,"Karelia Дуб Select Matt","доска Karelia Дуб Select Matt"
1527,"Karelia Ясень Natur Arctic","доска Karelia Ясень Natur Arctic"
1528,"Karelia Ясень Natur Vanilla Matt","доска Karelia Ясень Natur Vanilla Matt"
1529,"Karelia Ясень Amber","доска Karelia Ясень Amber"
1532,"Karelia Дуб Aged Stonewashed Ivory","доска Karelia Дуб Aged Stonewashed Ivory"
1530,"Karelia Дуб Shadow Grey","доска Karelia Дуб Shadow Grey"
1533,"Karelia Дуб Promenade Grey","доска Karelia Дуб Promenade Grey"
1534,"Wood Bee Дуб Кинг Браун","доска Wood Bee Дуб Кинг Браун"
1535,"Wood Bee Дуб Арктик","доска Wood Bee Дуб Арктик"
1536,"Wood Bee Ясень Арктик","доска Wood Bee Ясень Арктик"
1537,"Wood Bee Ясень Айс","доска Wood Bee Ясень Айс"
1538,"Wood Bee Дуб Вайт","доска Wood Bee Дуб Вайт"
1539,"Wood Bee Дуб Селект","доска Wood Bee Дуб Селект"
1540,"Wood Bee Дуб селект Браш","доска Wood Bee Дуб селект Браш"
1541,"Wood Bee Дуб Коньяк","доска Wood Bee Дуб Коньяк"
1542,"Wood Bee Дуб Коттедж","доска Wood Bee Дуб Коттедж"
1543,"Wood Bee Дуб Экспрешен","доска Wood Bee Дуб Экспрешен"
1544,"Wood Bee Дуб Антик Блэк","доска Wood Bee Дуб Антик Блэк"
1545,"Wood Bee Дуб Хистори","доска Wood Bee Дуб Хистори"
1547,"Wood Bee Дуссие","доска Wood Bee Дуссие"
1548,"Wood Bee Орех Американский","доска Wood Bee Орех Американский"
1550,"Boen-Hohns Дуб 4-х полосный Forte Сатиновый лак","доска Boen-Hohns Дуб 4-х полосный Forte Сатиновый лак"
1551,"Boen-Hohns Бук Animoso Сатиновый лак","доска Boen-Hohns Бук Animoso Сатиновый лак"
1552,"Boen-Hohns Дуб 4-х полосный Forte  матовый лак","доска Boen-Hohns Дуб 4-х полосный Forte  матовый лак"
1553,"Boen-Hohns Бук Animoso матовый лак","доска Boen-Hohns Бук Animoso матовый лак"
1554,"Boen-Hohns Ясень Allegro Сатиновый лак","доска Boen-Hohns Ясень Allegro Сатиновый лак"
1555,"Boen-Hohns Дуб 4-х полосный Forte  масло NaturalPlus","доска Boen-Hohns Дуб 4-х полосный Forte  масло NaturalPlus"
1556,"Boen-Hohns Бук Animoso масло NaturalPlus","доска Boen-Hohns Бук Animoso масло NaturalPlus"
1557,"Boen-Hohns Дуб Finale Сатиновый лак","доска Boen-Hohns Дуб Finale Сатиновый лак"
1558,"Boen-Hohns Ясень Allegro матовый лак","доска Boen-Hohns Ясень Allegro матовый лак"
1559,"Boen-Hohns Бук Andante Сатиновый лак","доска Boen-Hohns Бук Andante Сатиновый лак"
1560,"Boen-Hohns Дуб Andante Сатиновый лак","доска Boen-Hohns Дуб Andante Сатиновый лак"
1561,"Boen-Hohns Ясень белый Allegro матовый лак","доска Boen-Hohns Ясень белый Allegro матовый лак"
1562,"Boen-Hohns Дуб Finale матовый лак","доска Boen-Hohns Дуб Finale матовый лак"
1564,"Boen-Hohns Дуб Finale  масло NaturalPlus","доска Boen-Hohns Дуб Finale  масло NaturalPlus"
1563,"Boen-Hohns Бук Andante матовый лак","доска Boen-Hohns Бук Andante матовый лак"
1565,"Boen-Hohns Бук Andante масло NaturalPlus","доска Boen-Hohns Бук Andante масло NaturalPlus"
1566,"Boen-Hohns Дуб белый concerto матовый лак","доска Boen-Hohns Дуб белый concerto матовый лак"
1567,"Boen-Hohns Дуб Vivo лак","доска Boen-Hohns Дуб Vivo лак"
1568,"Coswick Дуб Графит / Graphite","доска Coswick Дуб Графит / Graphite"
1569,"Coswick Ясень Нормандский бриз(Norman breeze)","доска Coswick Ясень Нормандский бриз(Norman breeze)"
1570,"Coswick Дуб Туманные фьорды","доска Coswick Дуб Туманные фьорды"
1571,"Coswick Дуб Терракота / Terracotta","доска Coswick Дуб Терракота / Terracotta"
1572,"Coswick Дуб Френч эстейт / French Estate","доска Coswick Дуб Френч эстейт / French Estate"
1573,"Coswick Дуб Антик белый / Antique white","доска Coswick Дуб Антик белый / Antique white"
1574,"Coswick Дуб Терра / Terra","доска Coswick Дуб Терра / Terra"
1575,"Coswick Дуб Античная патина / Antique Patina","доска Coswick Дуб Античная патина / Antique Patina"
1576,"Coswick Дуб Серый кашемир / Grey Cashmere","доска Coswick Дуб Серый кашемир / Grey Cashmere"
1577,"Coswick Дуб Белый мрамор / White Marble","доска Coswick Дуб Белый мрамор / White Marble"
1579,"Coswick Дуб Орех / Chestnut","доска Coswick Дуб Орех / Chestnut"
1578,"Coswick Дуб Натуральный / Natural","доска Coswick Дуб Натуральный / Natural"
1580,"Coswick Дуб Бразильский орех / Walnut","доска Coswick Дуб Бразильский орех / Walnut"
1581,"Coswick Дуб Молочный шоколад / Milk chocolate","доска Coswick Дуб Молочный шоколад / Milk chocolate"
1582,"Coswick Дуб Шамбор / Chambord","доска Coswick Дуб Шамбор / Chambord"
1584,"Coswick Термо Дуб натуральный","доска Coswick Термо Дуб натуральный"
1583,"Coswick Дуб Пастель / Pastel","доска Coswick Дуб Пастель / Pastel"
1585,"Universal Дуб Прайм Купучино","доска Universal Дуб Прайм Купучино"
1586,"Universal Сапеле натур","доска Universal Сапеле натур"
1587,"Universal Дуб Прайм Патина, термо, брашировка","доска Universal Дуб Прайм Патина, термо, брашировка"
1588,"Universal Дуб Прайм Маренго, термо, глуб.брашировка","доска Universal Дуб Прайм Маренго, термо, глуб.брашировка"
1589,"Universal Мербау","доска Universal Мербау"
1590,"Universal Салигна Натур  (Эвкалипт)","доска Universal Салигна Натур  (Эвкалипт)"
1591,"Universal Дуб Белый Голландский рисунок","доска Universal Дуб Белый Голландский рисунок"
1592,"Universal Американский Красный Дуб Прайм","доска Universal Американский Красный Дуб Прайм"
1593,"Universal Мербау","доска Universal Мербау"
1594,"Universal Дуб Прайм Поместье, фаски 2V","доска Universal Дуб Прайм Поместье, фаски 2V"
1595,"Universal Американский орех прайм","доска Universal Американский орех прайм"
1596,"Universal Дуб Прайм Белый, фаски 2V, брашировка","доска Universal Дуб Прайм Белый, фаски 2V, брашировка"
1597,"Universal Ятоба","доска Universal Ятоба"
1598,"Universal Ясень Прайм Белый","доска Universal Ясень Прайм Белый"
1599,"Universal Дуб Прайм Снежный, фаски 2V","доска Universal Дуб Прайм Снежный, фаски 2V"
1600,"Universal Дуб Прайм Маренго, глубокая браш63.","доска Universal Дуб Прайм Маренго, глубокая браш63."
1601,"Universal Дуб Перигорд, брашировка, фаски 4V","доска Universal Дуб Перигорд, брашировка, фаски 4V"
1602,"Universal Дуб прайм термо","доска Universal Дуб прайм термо"
1604,"Timberwise Дуб Choco 70%","доска Timberwise Дуб Choco 70%"
1603,"Universal Дуб Прайм Капучино Браш","доска Universal Дуб Прайм Капучино Браш"
1605,"Timberwise Дуб Choco 100%","доска Timberwise Дуб Choco 100%"
1606,"Timberwise Дуб Cream","доска Timberwise Дуб Cream"
1607,"Timberwise Дуб Granite Gray","доска Timberwise Дуб Granite Gray"
1609,"Timberwise Дуб Moonstone","доска Timberwise Дуб Moonstone"
1608,"Timberwise Дуб Gray","доска Timberwise Дуб Gray"
1610,"Timberwise Дуб Pacific","доска Timberwise Дуб Pacific"
1611,"Timberwise Дуб Polar","доска Timberwise Дуб Polar"
1612,"Timberwise Дуб Sea Clam","доска Timberwise Дуб Sea Clam"
1614,"Timberwise Дуб White","доска Timberwise Дуб White"
1613,"Timberwise Дуб Tundra","доска Timberwise Дуб Tundra"
1615,"Timberwise Дуб Antarctis","доска Timberwise Дуб Antarctis"
1616,"Timberwise Дуб Antique","доска Timberwise Дуб Antique"
1617,"Timberwise Дуб Arctic","доска Timberwise Дуб Arctic"
1618,"Timberwise Дуб Blackwhite","доска Timberwise Дуб Blackwhite"
1619,"Timberwise Дуб Clay","доска Timberwise Дуб Clay"
1620,"Timberwise Дуб Cognac","доска Timberwise Дуб Cognac"
1622,"Timberwise Дуб Eben","доска Timberwise Дуб Eben"
1621,"Timberwise Дуб Eben","доска Timberwise Дуб Eben"
1623,"Old Wood Дуб Коньяк","доска Old Wood Дуб Коньяк"
1625,"Old Wood Дуб Снежный","доска Old Wood Дуб Снежный"
1626,"Old Wood Ясень Мокко ТЕРМО","доска Old Wood Ясень Мокко ТЕРМО"
1627,"Old Wood Дуб Какао ТЕРМО","доска Old Wood Дуб Какао ТЕРМО"
1624,"Old Wood Дуб Шоколад","доска Old Wood Дуб Шоколад"
1629,"Old Wood Дуб Мускат ТЕРМО","доска Old Wood Дуб Мускат ТЕРМО"
1628,"Old Wood Дуб Коньяк Рустик","доска Old Wood Дуб Коньяк Рустик"
1630,"Old Wood Дуб Арктика (Снежный)","доска Old Wood Дуб Арктика (Снежный)"
1631,"Old Wood Ясень Арктика (Снежный)","доска Old Wood Ясень Арктика (Снежный)"
1632,"Old Wood Дуб Мокко классик ТЕРМО","доска Old Wood Дуб Мокко классик ТЕРМО"
1633,"Old Wood Дуб Натуральный рустик","доска Old Wood Дуб Натуральный рустик"
1634,"Old Wood Дуб Капучино рустик ТЕРМО","доска Old Wood Дуб Капучино рустик ТЕРМО"
1635,"Old Wood Дуб Натуральный Коньячный пигмент","доска Old Wood Дуб Натуральный Коньячный пигмент"
1636,"Old Wood Дуб Янтарь рустик ТЕРМО","доска Old Wood Дуб Янтарь рустик ТЕРМО"
1637,"Old Wood Дуб Капучино белый пигмент ТЕРМО","доска Old Wood Дуб Капучино белый пигмент ТЕРМО"
1638,"Old Wood Дуб Нордик Рустик ТЕРМО","доска Old Wood Дуб Нордик Рустик ТЕРМО"
1639,"Old Wood Дуб Натуральный белый пигмент (Антик)","доска Old Wood Дуб Натуральный белый пигмент (Антик)"
1640,"Old Wood Дуб Натуральный Комфорт","доска Old Wood Дуб Натуральный Комфорт"
1641,"Old Wood Ясень Крем белый","доска Old Wood Ясень Крем белый"
1642,"Panaget Французский дуб Перлина","доска Panaget Французский дуб Перлина"
1643,"Panaget Французский дуб Табак","доска Panaget Французский дуб Табак"
1644,"Panaget Французский дуб Селадо","доска Panaget Французский дуб Селадо"
1645,"Panaget Французский дуб Линен","доска Panaget Французский дуб Линен"
1646,"Panaget Французский дуб Опал","доска Panaget Французский дуб Опал"
1648,"Panaget Французский дуб Плавающее дерево","доска Panaget Французский дуб Плавающее дерево"
1650,"Panaget Французский дуб Топаз","доска Panaget Французский дуб Топаз"
1652,"Weitzer Дуб Савана","доска Weitzer Дуб Савана"
1653,"Weitzer Орех пропаренный","доска Weitzer Орех пропаренный"
1654,"Weitzer Дуб Селект","доска Weitzer Дуб Селект"
1661,"Amber Wood Дуб Натур лак","доска Amber Wood Дуб Натур лак"
1663,"Amber Wood Дуб Белая ночь","доска Amber Wood Дуб Белая ночь"
1662,"Amber Wood Дуб Натур масло","доска Amber Wood Дуб Натур масло"
1664,"Amber Wood Дуб Арктик","доска Amber Wood Дуб Арктик"
1665,"Amber Wood Дуб Карамель","доска Amber Wood Дуб Карамель"
1666,"Amber Wood Дуб Селект","доска Amber Wood Дуб Селект"
1668,"Coswick Дуб Угольный","доска Coswick Дуб Угольный"
1667,"Amber Wood Дуб Селект","доска Amber Wood Дуб Селект"
1669,"Coswick Дуб Бразильский орех","доска Coswick Дуб Бразильский орех"
1670,"Coswick Дуб Орех (Chestnut)","доска Coswick Дуб Орех (Chestnut)"
