4484,"Boen-Hohns Дуб Mystic Jungle","доска Boen-Hohns Дуб Mystic Jungle"
4485,"Boen-Hohns Дуб Sandy Grey","доска Boen-Hohns Дуб Sandy Grey"
4486,"Boen-Hohns Дуб Shabby Cream","доска Boen-Hohns Дуб Shabby Cream"
4487,"Boen-Hohns Дуб Shabby White","доска Boen-Hohns Дуб Shabby White"
4488,"Boen-Hohns Дуб натур лак","доска Boen-Hohns Дуб натур лак"
4489,"Boen-Hohns Дуб белый лак","доска Boen-Hohns Дуб белый лак"
4490,"Boen-Hohns Дуб натур масло","доска Boen-Hohns Дуб натур масло"
4491,"Boen-Hohns Дуб белый масло","доска Boen-Hohns Дуб белый масло"
4494,"Boen-Hohns Дуб Arizona","доска Boen-Hohns Дуб Arizona"
4493,"Boen-Hohns Дуб дымчатый масло","доска Boen-Hohns Дуб дымчатый масло"
4492,"Boen-Hohns Дуб дымчатый лак","доска Boen-Hohns Дуб дымчатый лак"
4495,"Boen-Hohns Дуб Animoso матовый лак","доска Boen-Hohns Дуб Animoso матовый лак"
4497,"Boen-Hohns Дуб Animoso масло","доска Boen-Hohns Дуб Animoso масло"
4496,"Boen-Hohns Дуб белый Animoso  лак","доска Boen-Hohns Дуб белый Animoso  лак"
4499,"Boen-Hohns Дуб Animoso масло, браш","доска Boen-Hohns Дуб Animoso масло, браш"
4498,"Boen-Hohns Дуб белый Animoso масло","доска Boen-Hohns Дуб белый Animoso масло"
4500,"Boen-Hohns Дуб Old Grey","доска Boen-Hohns Дуб Old Grey"
4501,"Boen-Hohns Дуб Andante матовый лак","доска Boen-Hohns Дуб Andante матовый лак"
4503,"Boen-Hohns Дуб Pearl","доска Boen-Hohns Дуб Pearl"
4502,"Boen-Hohns Дуб белый Andante лак","доска Boen-Hohns Дуб белый Andante лак"
4504,"Boen-Hohns Дуб Andante масло","доска Boen-Hohns Дуб Andante масло"
4505,"Boen-Hohns Дуб белый Andante масло","доска Boen-Hohns Дуб белый Andante масло"
4506,"Boen-Hohns Дуб Sand","доска Boen-Hohns Дуб Sand"
4507,"Boen-Hohns Дуб Сoral","доска Boen-Hohns Дуб Сoral"
4508,"Boen-Hohns Дуб Graphite","доска Boen-Hohns Дуб Graphite"
4509,"Boen-Hohns Дуб Andante масло, браш","доска Boen-Hohns Дуб Andante масло, браш"
4510,"Boen-Hohns Дуб Lava","доска Boen-Hohns Дуб Lava"
4511,"Boen-Hohns Дуб Stone","доска Boen-Hohns Дуб Stone"
4512,"Boen-Hohns Дуб копченый масло","доска Boen-Hohns Дуб копченый масло"
4514,"Boen-Hohns Американский орех Andante лак","доска Boen-Hohns Американский орех Andante лак"
4513,"Boen-Hohns Американский орех Animoso лак","доска Boen-Hohns Американский орех Animoso лак"
4515,"Boen-Hohns Американский орех Andante масло","доска Boen-Hohns Американский орех Andante масло"
4516,"Boen-Hohns Дуб Animoso Live Pure","доска Boen-Hohns Дуб Animoso Live Pure"
4517,"Boen-Hohns Орех американский Andante Live Pure","доска Boen-Hohns Орех американский Andante Live Pure"
4518,"Boen-Hohns Дуб Vivo матовый лак","доска Boen-Hohns Дуб Vivo матовый лак"
4519,"Boen-Hohns Дуб Vivo масло","доска Boen-Hohns Дуб Vivo масло"
4520,"Boen-Hohns Дуб Vivo масло, браш","доска Boen-Hohns Дуб Vivo масло, браш"
4521,"Boen-Hohns Ясень Animoso сатиновый лак","доска Boen-Hohns Ясень Animoso сатиновый лак"
4523,"Boen-Hohns Дуб Andante матовый лак","доска Boen-Hohns Дуб Andante матовый лак"
4524,"Boen-Hohns Дуб белый Animoso матовый лак","доска Boen-Hohns Дуб белый Animoso матовый лак"
4522,"Boen-Hohns Дуб Provence сатиновый лак","доска Boen-Hohns Дуб Provence сатиновый лак"
4525,"Boen-Hohns Дуб Animoso Масло","доска Boen-Hohns Дуб Animoso Масло"
4526,"Boen-Hohns Дуб белый Animoso масло","доска Boen-Hohns Дуб белый Animoso масло"
4528,"Boen-Hohns Дуб Toscana матовый лак","доска Boen-Hohns Дуб Toscana матовый лак"
4529,"Boen-Hohns Дуб Cordoba матовый лак","доска Boen-Hohns Дуб Cordoba матовый лак"
4527,"Boen-Hohns Дуб Animoso Матовый лак","доска Boen-Hohns Дуб Animoso Матовый лак"
4530,"Boen-Hohns Дуб Arizona матовый лак","доска Boen-Hohns Дуб Arizona матовый лак"
4532,"Boen-Hohns Дуб Andante масло","доска Boen-Hohns Дуб Andante масло"
4531,"Boen-Hohns Дуб белый Andante матовый лак","доска Boen-Hohns Дуб белый Andante матовый лак"
4533,"Boen-Hohns Дуб белый Andante масло","доска Boen-Hohns Дуб белый Andante масло"
4534,"Boen-Hohns Дуб Andante масло, браш","доска Boen-Hohns Дуб Andante масло, браш"
4535,"Boen-Hohns Ясень белый Andante матовый лак","доска Boen-Hohns Ясень белый Andante матовый лак"
4536,"Boen-Hohns Дуб Noir сатиновый лак","доска Boen-Hohns Дуб Noir сатиновый лак"
4538,"Boen-Hohns Дуб белый andante матовый лак","доска Boen-Hohns Дуб белый andante матовый лак"
4537,"Boen-Hohns Ясень Polar матовый лак","доска Boen-Hohns Ясень Polar матовый лак"
4539,"Boen-Hohns Дуб белый andante масло NaturalPlus","доска Boen-Hohns Дуб белый andante масло NaturalPlus"
4540,"Boen-Hohns Клен  Канадский Animoso Сатиновый лак","доска Boen-Hohns Клен  Канадский Animoso Сатиновый лак"
4541,"Boen-Hohns Клен Канадский  Andante Сатиновый лак","доска Boen-Hohns Клен Канадский  Andante Сатиновый лак"
4542,"Boen-Hohns Клен Канадский Andante матовый лак","доска Boen-Hohns Клен Канадский Andante матовый лак"
4543,"Boen-Hohns Клен Канадский  Andante масло NaturalPlus","доска Boen-Hohns Клен Канадский  Andante масло NaturalPlus"
4544,"Boen-Hohns Ироко/Камбала Protect-Ultra лак","доска Boen-Hohns Ироко/Камбала Protect-Ultra лак"
4545,"Boen-Hohns Ироко/Камбала матовый лак","доска Boen-Hohns Ироко/Камбала матовый лак"
4546,"Coswick Ясень Лунный свет / Moonlight Селект энд Беттер","доска Coswick Ясень Лунный свет / Moonlight Селект энд Беттер"
4547,"Coswick Ясень Серебристый / Silvery Селект энд Беттер","доска Coswick Ясень Серебристый / Silvery Селект энд Беттер"
4549,"Coswick Ясень Жемчужный / Pearl Grey Селект энд Беттер","доска Coswick Ясень Жемчужный / Pearl Grey Селект энд Беттер"
4548,"Coswick Ясень Капучино / Cappuccino Селект энд Беттер","доска Coswick Ясень Капучино / Cappuccino Селект энд Беттер"
4550,"Coswick Ясень Комо / Como Селект энд Беттер","доска Coswick Ясень Комо / Como Селект энд Беттер"
4551,"Coswick Ясень Тигровый глаз / Tiger Eye Селект энд Беттер","доска Coswick Ясень Тигровый глаз / Tiger Eye Селект энд Беттер"
4552,"Coswick Дуб Барселона","доска Coswick Дуб Барселона"
4553,"Coswick Дуб Лондон","доска Coswick Дуб Лондон"
4554,"Coswick Дуб Старая Венеция","доска Coswick Дуб Старая Венеция"
4555,"Coswick Дуб Марсель","доска Coswick Дуб Марсель"
4557,"Coswick Дуб Батист","доска Coswick Дуб Батист"
4556,"Coswick Дуб Женева","доска Coswick Дуб Женева"
4558,"Coswick Дуб Вена","доска Coswick Дуб Вена"
4559,"Coswick Ясень Мокка (Mocca)","доска Coswick Ясень Мокка (Mocca)"
4560,"Coswick Ясень Облачный (Cloudy)","доска Coswick Ясень Облачный (Cloudy)"
4562,"Coswick Ясень Лунный свет (Moonlight)","доска Coswick Ясень Лунный свет (Moonlight)"
4561,"Coswick Ясень Молочный шоколад (Milk chocolate)","доска Coswick Ясень Молочный шоколад (Milk chocolate)"
4563,"Coswick Ясень Венге (Wenge)","доска Coswick Ясень Венге (Wenge)"
4564,"Coswick Ясень Карамель (Caramel)","доска Coswick Ясень Карамель (Caramel)"
4565,"Coswick Дуб Берген","доска Coswick Дуб Берген"
4566,"Coswick Дуб Древесный агат","доска Coswick Дуб Древесный агат"
4567,"Coswick Дуб Сизый мох","доска Coswick Дуб Сизый мох"
4568,"Coswick Дуб Скандинавский","доска Coswick Дуб Скандинавский"
4569,"Coswick Дуб Полярная ночь","доска Coswick Дуб Полярная ночь"
4570,"Coswick Дуб Вересковый","доска Coswick Дуб Вересковый"
4571,"Coswick Дуб Альбион","доска Coswick Дуб Альбион"
4572,"Coswick Термо Ясень натуральный","доска Coswick Термо Ясень натуральный"
4573,"Coswick Термо Ясень Коричневый солод","доска Coswick Термо Ясень Коричневый солод"
4574,"Coswick Термо Дуб Нордик","доска Coswick Термо Дуб Нордик"
4575,"Coswick Термо Ясень Эверест","доска Coswick Термо Ясень Эверест"
4577,"Coswick Термо Дуб Дымчатые горы","доска Coswick Термо Дуб Дымчатые горы"
4576,"Coswick Термо Дуб Умбра","доска Coswick Термо Дуб Умбра"
4579,"Coswick Натуральный Американский орех (1331-1101) Селект энд Бэттер","доска Coswick Натуральный Американский орех (1331-1101) Селект энд Бэттер"
4578,"Coswick Натуральный Американский орех (1332-3101) Традишинал","доска Coswick Натуральный Американский орех (1332-3101) Традишинал"
4580,"Coswick Классический Американский орех (1332-3161)","доска Coswick Классический Американский орех (1332-3161)"
4581,"Coswick Классический Американский орех (1332-3961) Натур","доска Coswick Классический Американский орех (1332-3961) Натур"
4583,"Coswick Натуральный Американский орех (1332-1101) Селект энд Бэттер","доска Coswick Натуральный Американский орех (1332-1101) Селект энд Бэттер"
4582,"Coswick Классический Американский орех (1332-3261) Натур","доска Coswick Классический Американский орех (1332-3261) Натур"
4584,"Coswick Натуральный Американский орех (1336-1101) Селект энд Бэттер","доска Coswick Натуральный Американский орех (1336-1101) Селект энд Бэттер"
4585,"Kahrs Дуб Карамель (Традиционная американская коллекция)","доска Kahrs Дуб Карамель (Традиционная американская коллекция)"
4586,"Kahrs Дуб Сорренто  (Песочная коллекция)","доска Kahrs Дуб Сорренто  (Песочная коллекция)"
4588,"Kahrs Клен Зальцбург (Европейская коллекция)","доска Kahrs Клен Зальцбург (Европейская коллекция)"
4589,"Kahrs Дуб Вена (Европейская коллекция)","доска Kahrs Дуб Вена (Европейская коллекция)"
4587,"Kahrs Ясень Скаген  (Песочная коллекция)","доска Kahrs Ясень Скаген  (Песочная коллекция)"
4590,"Kahrs Дуб Канкун  (Песочная коллекция)","доска Kahrs Дуб Канкун  (Песочная коллекция)"
4592,"Kahrs Дуб Роса (Гармония)","доска Kahrs Дуб Роса (Гармония)"
4591,"Kahrs Дуб Стратус (Гармония)","доска Kahrs Дуб Стратус (Гармония)"
4594,"Kahrs Дуб Лава (Гармония)","доска Kahrs Дуб Лава (Гармония)"
4593,"Kahrs Дуб Мороз (Гармония)","доска Kahrs Дуб Мороз (Гармония)"
4595,"Kahrs Дуб Камень (Гармония)","доска Kahrs Дуб Камень (Гармония)"
4597,"Kahrs Дуб Дым (Гармония)","доска Kahrs Дуб Дым (Гармония)"
4596,"Kahrs Дуб Известняк (Гармония)","доска Kahrs Дуб Известняк (Гармония)"
4599,"Kahrs Вишня Саванна (Американская коллекция)","доска Kahrs Вишня Саванна (Американская коллекция)"
4598,"Kahrs Клен Торонто (Американская коллекция)","доска Kahrs Клен Торонто (Американская коллекция)"
4600,"Kahrs Дуб Грунт (Гармония)","доска Kahrs Дуб Грунт (Гармония)"
4602,"Kahrs Дуб Ядро (Гармония)","доска Kahrs Дуб Ядро (Гармония)"
4601,"Kahrs Ясень Алебастр (Гармония)","доска Kahrs Ясень Алебастр (Гармония)"
4604,"Kahrs Дуб Сливки (Гармония)","доска Kahrs Дуб Сливки (Гармония)"
4603,"Kahrs Дуб Фасоль (Гармония)","доска Kahrs Дуб Фасоль (Гармония)"
4605,"Kahrs Дуб Перистые облака (Гармония)","доска Kahrs Дуб Перистые облака (Гармония)"
4606,"Kahrs Дуб Гранит (Гармония)","доска Kahrs Дуб Гранит (Гармония)"
4609,"Kahrs Дуб Верона матовый лак браш (Европейская коллекция)","доска Kahrs Дуб Верона матовый лак браш (Европейская коллекция)"
4608,"Kahrs Дуб Верона матовый лак (Европейская коллекция)","доска Kahrs Дуб Верона матовый лак (Европейская коллекция)"
4607,"Kahrs Дуб Верона сатиновый лак (Европейская коллекция)","доска Kahrs Дуб Верона сатиновый лак (Европейская коллекция)"
4610,"Kahrs Дуб Хемпшир сатиновый лак (Европейская коллекция)","доска Kahrs Дуб Хемпшир сатиновый лак (Европейская коллекция)"
4611,"Kahrs Дуб Джерси (Европейская коллекция)","доска Kahrs Дуб Джерси (Европейская коллекция)"
4612,"Kahrs Дуб Хемпшир матовый лак (Европейская коллекция)","доска Kahrs Дуб Хемпшир матовый лак (Европейская коллекция)"
4613,"Kahrs Дуб Корнвол (Европейская коллекция)","доска Kahrs Дуб Корнвол (Европейская коллекция)"
4614,"Kahrs Дуб Палаццо Ровере (Европейский ренесанс)","доска Kahrs Дуб Палаццо Ровере (Европейский ренесанс)"
4615,"Kahrs Дуб Палаццо Бьянко (Европейский ренесанс)","доска Kahrs Дуб Палаццо Бьянко (Европейский ренесанс)"
4617,"Kahrs Ярра Сидней (Мировая коллекция)","доска Kahrs Ярра Сидней (Мировая коллекция)"
4616,"Kahrs Дуб Палаццо Фумо (Европейский ренесанс)","доска Kahrs Дуб Палаццо Фумо (Европейский ренесанс)"
4618,"Kahrs Дуб Романов (Наследие)","доска Kahrs Дуб Романов (Наследие)"
4619,"Kahrs Дуб Плантагенет (Наследие)","доска Kahrs Дуб Плантагенет (Наследие)"
4620,"Kahrs Дуб Валуа (Наследие)","доска Kahrs Дуб Валуа (Наследие)"
4622,"Kahrs Дуб Чёрный (Новая классическая коллекция)","доска Kahrs Дуб Чёрный (Новая классическая коллекция)"
4621,"Kahrs Дуб Шарколь (Новая классическая коллекция)","доска Kahrs Дуб Шарколь (Новая классическая коллекция)"
4624,"Kahrs Дуб Снег (Новая классическая коллекция)","доска Kahrs Дуб Снег (Новая классическая коллекция)"
4623,"Kahrs Дуб Титан (Новая классическая коллекция)","доска Kahrs Дуб Титан (Новая классическая коллекция)"
4625,"Kahrs Дуб Белый (Новая классическая коллекция)","доска Kahrs Дуб Белый (Новая классическая коллекция)"
4626,"Kahrs Ясень Мариехамн  (Песочная коллекция)","доска Kahrs Ясень Мариехамн  (Песочная коллекция)"
4627,"Kahrs Дуб Портофино  (Песочная коллекция)","доска Kahrs Дуб Портофино  (Песочная коллекция)"
4629,"Kahrs Дуб Брайтон (Песочная коллекция)","доска Kahrs Дуб Брайтон (Песочная коллекция)"
4628,"Kahrs Ясень Фальстербо  (Песочная коллекция)","доска Kahrs Ясень Фальстербо  (Песочная коллекция)"
4630,"Kahrs Ясень Сендвиг  (Песочная коллекция)","доска Kahrs Ясень Сендвиг  (Песочная коллекция)"
4631,"Kahrs Ясень Аалборг  (Песочная коллекция)","доска Kahrs Ясень Аалборг  (Песочная коллекция)"
4633,"Kahrs Ясень Готланд (Скандинавская коллекция)","доска Kahrs Ясень Готланд (Скандинавская коллекция)"
4632,"Kahrs Ясень Гетеборг (Скандинавская коллекция)","доска Kahrs Ясень Гетеборг (Скандинавская коллекция)"
4634,"Kahrs Дуб Дублин сатиновый лак (Столичная коллекция)","доска Kahrs Дуб Дублин сатиновый лак (Столичная коллекция)"
4635,"Kahrs Дуб Дублин натуральное масло (Столичная коллекция)","доска Kahrs Дуб Дублин натуральное масло (Столичная коллекция)"
4636,"Kahrs Дуб Дублин матовый лак (Столичная коллекция)","доска Kahrs Дуб Дублин матовый лак (Столичная коллекция)"
4638,"Kahrs Дуб Париж масло белое (Столичная коллекция)","доска Kahrs Дуб Париж масло белое (Столичная коллекция)"
4639,"Kahrs Дуб Берлин (Столичная коллекция)","доска Kahrs Дуб Берлин (Столичная коллекция)"
4637,"Kahrs Дуб Париж матовы лак (Столичная коллекция)","доска Kahrs Дуб Париж матовы лак (Столичная коллекция)"
4641,"Timberwise Дуб  Antique масло/лак","доска Timberwise Дуб  Antique масло/лак"
4642,"Timberwise Дуб  Arctic масло/лак","доска Timberwise Дуб  Arctic масло/лак"
4643,"Timberwise Дуб  BlacWhitre масло","доска Timberwise Дуб  BlacWhitre масло"
4644,"Timberwise Дуб  Eben масло/лак","доска Timberwise Дуб  Eben масло/лак"
4645,"Timberwise Дуб  Antarctis лак","доска Timberwise Дуб  Antarctis лак"
4646,"Timberwise Дуб  Antique масло/лак","доска Timberwise Дуб  Antique масло/лак"
4647,"Timberwise Дуб Classic White Cream масло/лак","доска Timberwise Дуб Classic White Cream масло/лак"
4649,"Timberwise Дуб Classic Walnut лак","доска Timberwise Дуб Classic Walnut лак"
4648,"Timberwise Дуб Classic Silver масло","доска Timberwise Дуб Classic Silver масло"
4650,"Timberwise Дуб Classic Wenge лак","доска Timberwise Дуб Classic Wenge лак"
4651,"Timberwise Дуб Classic Cognac масло/лак","доска Timberwise Дуб Classic Cognac масло/лак"
4653,"Timberwise Ясень Eben масло","доска Timberwise Ясень Eben масло"
4652,"Timberwise Дуб Classic Nordic масло/лак","доска Timberwise Дуб Classic Nordic масло/лак"
4654,"Timberwise Ясень Classic Antarctis мат.лак","доска Timberwise Ясень Classic Antarctis мат.лак"
4655,"Timberwise Дуб Cream масло/лак","доска Timberwise Дуб Cream масло/лак"
4656,"Timberwise Дуб Grey масло/лак","доска Timberwise Дуб Grey масло/лак"
4657,"Timberwise Дуб Polar лак","доска Timberwise Дуб Polar лак"
4658,"Timberwise Дуб Choco 100% масло/лак","доска Timberwise Дуб Choco 100% масло/лак"
4659,"Timberwise Дуб Choco 70% масло/лак","доска Timberwise Дуб Choco 70% масло/лак"
4660,"Timberwise Дуб Dark Smoke масло/лак","доска Timberwise Дуб Dark Smoke масло/лак"
4661,"Timberwise Дуб Dark Carbon White масло/лак","доска Timberwise Дуб Dark Carbon White масло/лак"
4663,"Par-Ky Афзелия brushed SB+302","доска Par-Ky Афзелия brushed SB+302"
4662,"Timberwise Дуб ТМТ Dark масло/лак","доска Timberwise Дуб ТМТ Dark масло/лак"
4665,"Par-Ky Зебрано SS+312","доска Par-Ky Зебрано SS+312"
4664,"Par-Ky Имбуиа (Imbuia) SS+309","доска Par-Ky Имбуиа (Imbuia) SS+309"
4666,"Par-Ky Santos Палиcандр SS+306","доска Par-Ky Santos Палиcандр SS+306"
4668,"Par-Ky Олива SS+310","доска Par-Ky Олива SS+310"
4667,"Par-Ky Яблоня indian SS+311","доска Par-Ky Яблоня indian SS+311"
4670,"Par-Ky Дуб Ivory brushed DB+102","доска Par-Ky Дуб Ivory brushed DB+102"
4669,"Par-Ky Shadow Макассар SS+305","доска Par-Ky Shadow Макассар SS+305"
4671,"Par-Ky Сукупира DS+303","доска Par-Ky Сукупира DS+303"
4673,"5832, Груша Изящная","Alloc 5832, Груша Изящная"
4672,"8520, Дуб Каньон Светлый","Alloc 8520, Дуб Каньон Светлый"
4675,"5601, Клен Винтажный","Alloc 5601, Клен Винтажный"
4674,"5812, Мербау Палуба","Alloc 5812, Мербау Палуба"
4676,"Tavolini Floors Французская елка Дуб Fresco","доска Tavolini Floors Французская елка Дуб Fresco"
4678,"Tavolini Floors Французская елка Дуб Dante","доска Tavolini Floors Французская елка Дуб Dante"
4677,"Tavolini Floors Французская елка Дуб Etna","доска Tavolini Floors Французская елка Дуб Etna"
4681,"Орех -  255","Progress Орех -  255"
4679,"Tavolini Floors Французская елка Дуб Bruno","доска Tavolini Floors Французская елка Дуб Bruno"
4682,"Орех горный белый -  240","Progress Орех горный белый -  240"
4683,"Орех горный натур -  239","Progress Орех горный натур -  239"
4684,"Орех горный серый -  238","Progress Орех горный серый -  238"
4685,"Орех селект х170","паркет  Орех селект х170"
4686,"Орех селект х150","паркет  Орех селект х150"
4687,"Орех селект х127","паркет  Орех селект х127"
4688,"Esta Parket Орех американский City","доска Esta Parket Орех американский City"
4689,"Amigo Орех американский Натур","доска Amigo Орех американский Натур"
4690,"Amigo Американский орех Арабика","доска Amigo Американский орех Арабика"
