2182,"Magestik Floor Дуб Клауд браш","доска Magestik Floor Дуб Клауд браш"
2183,"Magestik Floor Дуб Грей Мун браш","доска Magestik Floor Дуб Грей Мун браш"
2184,"Magestik Floor Ипе","доска Magestik Floor Ипе"
2186,"Magestik Floor Кумару Красный","доска Magestik Floor Кумару Красный"
2185,"Magestik Floor Мербау","доска Magestik Floor Мербау"
2187,"Magestik Floor Дуб Селект","доска Magestik Floor Дуб Селект"
2188,"Magestik Floor Дуб Термо","доска Magestik Floor Дуб Термо"
2189,"Amber Wood Дуб черно-белый 18х120х300-1800","доска Amber Wood Дуб черно-белый 18х120х300-1800"
2191,"Amber Wood Дуб Кофе 18х120х300-1800","доска Amber Wood Дуб Кофе 18х120х300-1800"
2190,"Amber Wood Дуб Мокко 18х120х300-1800","доска Amber Wood Дуб Мокко 18х120х300-1800"
2192,"Amber Wood Дуб Светлый Орех 18х120х300-1800","доска Amber Wood Дуб Светлый Орех 18х120х300-1800"
2193,"Amber Wood Дуб Шоколад 18 х 120 х 300-1800 мм","доска Amber Wood Дуб Шоколад 18 х 120 х 300-1800 мм"
2194,"Amber Wood Дуб Ваниль 18х120х300-1800","доска Amber Wood Дуб Ваниль 18х120х300-1800"
2196,"Amber Wood Дуб Арктик 18х120х300-1800","доска Amber Wood Дуб Арктик 18х120х300-1800"
2195,"Amber Wood Дуб Коттедж браш 18х120х300-1800","доска Amber Wood Дуб Коттедж браш 18х120х300-1800"
2197,"Amber Wood Дуб Белая Ночь 18х120х300-1800","доска Amber Wood Дуб Белая Ночь 18х120х300-1800"
2198,"Amber Wood Дуб Натур 18х120х300-1800","доска Amber Wood Дуб Натур 18х120х300-1800"
2199,"Sherwood Сапеле","доска Sherwood Сапеле"
2200,"Sherwood Афрормозия Средняя","доска Sherwood Афрормозия Средняя"
2201,"Sherwood Орех американский натур","доска Sherwood Орех американский натур"
2202,"Sherwood Тик Бирма","доска Sherwood Тик Бирма"
2203,"Sherwood Орех американский селект","доска Sherwood Орех американский селект"
2204,"Sherwood Палисандр","доска Sherwood Палисандр"
2205,"Bolefloor вишня","доска Bolefloor вишня"
2206,"Bolefloor дуб селект","доска Bolefloor дуб селект"
2207,"Bolefloor орех","доска Bolefloor орех"
2208,"Tavolini Floors Дуб Notte","доска Tavolini Floors Дуб Notte"
2209,"Tavolini Floors Дуб Ideale","доска Tavolini Floors Дуб Ideale"
2211,"Tavolini Floors Дуб Carta","доска Tavolini Floors Дуб Carta"
2210,"Tavolini Floors Дуб Fresco","доска Tavolini Floors Дуб Fresco"
2212,"Tavolini Floors Дуб Luna","доска Tavolini Floors Дуб Luna"
2213,"Tavolini Floors Дуб Sole","доска Tavolini Floors Дуб Sole"
2214,"Tavolini Floors Дуб Monte","доска Tavolini Floors Дуб Monte"
2216,"Tavolini Floors Дуб Amore","доска Tavolini Floors Дуб Amore"
2215,"Tavolini Floors Дуб Savoy","доска Tavolini Floors Дуб Savoy"
2217,"Tavolini Floors Дуб Viola","доска Tavolini Floors Дуб Viola"
2218,"Tavolini Floors Дуб Amigo","доска Tavolini Floors Дуб Amigo"
2219,"Tavolini Floors Дуб Libro","доска Tavolini Floors Дуб Libro"
2220,"Tavolini Floors Дуб Deco","доска Tavolini Floors Дуб Deco"
2221,"Tavolini Floors Дуб Vento","доска Tavolini Floors Дуб Vento"
2222,"Tavolini Floors Дуб Arena","доска Tavolini Floors Дуб Arena"
2223,"Tavolini Floors Дуб Conte","доска Tavolini Floors Дуб Conte"
2224,"Tavolini Floors Дуб Novo","доска Tavolini Floors Дуб Novo"
2225,"Tavolini Floors Дуб Stella","доска Tavolini Floors Дуб Stella"
2226,"Tavolini Floors Дуб Savio","доска Tavolini Floors Дуб Savio"
2227,"Berthold Дуб Paolo","доска Berthold Дуб Paolo"
2228,"Berthold Дуб Benno","доска Berthold Дуб Benno"
2229,"Berthold Дуб Rodolfo","доска Berthold Дуб Rodolfo"
2231,"Berthold Дуб Ricardo","доска Berthold Дуб Ricardo"
2230,"Berthold Дуб Lorenzo","доска Berthold Дуб Lorenzo"
2232,"Berthold Дуб Roberto","доска Berthold Дуб Roberto"
2233,"Berthold Дуб Johann","доска Berthold Дуб Johann"
2234,Ормозия,"доска  Ормозия"
2235,"Королевское дерево (Лаосский Орех)","доска  Королевское дерево (Лаосский Орех)"
2236,Балау,"доска  Балау"
2238,"ТИК без покрытия","доска  ТИК без покрытия"
2263,"M-47 дуб радиал, венге","паркет  M-47 дуб радиал, венге"
2240,"Вишня американская","доска  Вишня американская"
2265,"Siberian Floor Дуб Бурбон, лак УФ, цвет Сомбрэ МОДУЛЬ № 13","паркет Siberian Floor Дуб Бурбон, лак УФ, цвет Сомбрэ МОДУЛЬ № 13"
2264,"Siberian Floor Дуб цвет Гансток, морёный, текстурированный, лак УФ МОДУЛЬ № 10","паркет Siberian Floor Дуб цвет Гансток, морёный, текстурированный, лак УФ МОДУЛЬ № 10"
2266,"Siberian Floor Дуб Бурбон, лак УФ МОДУЛЬ № 4","паркет Siberian Floor Дуб Бурбон, лак УФ МОДУЛЬ № 4"
2267,"Siberian Floor Дуб Бурбон, масло Черное УФ МОДУЛЬ № 3","паркет Siberian Floor Дуб Бурбон, масло Черное УФ МОДУЛЬ № 3"
2268,"Siberian Floor Дуб Бурбон, цвет Баттэрскотч, лак УФ МОДУЛЬ № 2","паркет Siberian Floor Дуб Бурбон, цвет Баттэрскотч, лак УФ МОДУЛЬ № 2"
2269,"Siberian Floor Дуб Бурбон, цвет Баттэрскотч, лак УФ МОДУЛЬ № 2","паркет Siberian Floor Дуб Бурбон, цвет Баттэрскотч, лак УФ МОДУЛЬ № 2"
2270,"Coswick Provence (Прованс) - орех","паркет Coswick Provence (Прованс) - орех"
2271,"Marco Ferutti Castello - Дуб Грей","доска Marco Ferutti Castello - Дуб Грей"
2272,"Marco Ferutti Castello - Дуб Неро","доска Marco Ferutti Castello - Дуб Неро"
2273,"Marco Ferutti Hermitage - Орех американский","доска Marco Ferutti Hermitage - Орех американский"
2274,"Marco Ferutti Linea - Дуб Кембридж","доска Marco Ferutti Linea - Дуб Кембридж"
2275,"Marco Ferutti Castello - Дуб Кембридж","доска Marco Ferutti Castello - Дуб Кембридж"
2276,"Marco Ferutti Linea - Сапели","доска Marco Ferutti Linea - Сапели"
2277,М-245,"паркет  М-245"
2278,М-246,"паркет  М-246"
2279,М-247,"паркет  М-247"
2280,М-248,"паркет  М-248"
2281,М-249,"паркет  М-249"
2282,М-250,"паркет  М-250"
2283,М-251,"паркет  М-251"
2285,М-253,"паркет  М-253"
2284,М-252,"паркет  М-252"
2286,М-254,"паркет  М-254"
2287,М-255,"паркет  М-255"
2288,М-237,"паркет  М-237"
2289,М-238,"паркет  М-238"
2290,М-239,"паркет  М-239"
2291,М-240,"паркет  М-240"
2292,М-241,"паркет  М-241"
2293,М-242,"паркет  М-242"
2294,М-236,"паркет  М-236"
2295,"М-208 (дуб радиал, клен, ясень, мербау)","паркет  М-208 (дуб радиал, клен, ясень, мербау)"
2296,"М-204(дуб радиал, ясень, орех, венге)","паркет  М-204(дуб радиал, ясень, орех, венге)"
2297,"М-207 (дуб радиал, клен, ясень, мербау)","паркет  М-207 (дуб радиал, клен, ясень, мербау)"
2298,"М-206 (дуб радиал, клен,  ясень, мербау)","паркет  М-206 (дуб радиал, клен,  ясень, мербау)"
2299,"М-212 (дуб радиал, ясень, мербау)","паркет  М-212 (дуб радиал, ясень, мербау)"
2300,"М-201  (дуб радиал, клен, орех, венге)","паркет  М-201  (дуб радиал, клен, орех, венге)"
2301,"М-203 (дуб радиал, клен, орех)","паркет  М-203 (дуб радиал, клен, орех)"
2303,"М-210 (ясень, груша, венге)","паркет  М-210 (ясень, груша, венге)"
2302,"М-211 (дуб радиал, клен, ясень, мербау)","паркет  М-211 (дуб радиал, клен, ясень, мербау)"
2305,"М-202  (дуб радиал, клен, орех)","паркет  М-202  (дуб радиал, клен, орех)"
2304,"М-209 (дуб радиал, клен)","паркет  М-209 (дуб радиал, клен)"
2306,"М-196 (дуб радиал, клен, мербау)","паркет  М-196 (дуб радиал, клен, мербау)"
2307,"М-182 (дуб радиал, клен,ясень, мербау)","паркет  М-182 (дуб радиал, клен,ясень, мербау)"
2308,"М-195 (дуб стандарт, ясень, орех)","паркет  М-195 (дуб стандарт, ясень, орех)"
2309,"М-184 (дуб стандарт, клен, мербау)","паркет  М-184 (дуб стандарт, клен, мербау)"
2310,"М-180 (дуб радиал, клен, ясень, орех)","паркет  М-180 (дуб радиал, клен, ясень, орех)"
2311,"М-188 (дуб радиал, клен, мербау, венге)","паркет  М-188 (дуб радиал, клен, мербау, венге)"
2312,"М-186 ((дуб радиал, клен, мербау, орех)","паркет  М-186 ((дуб радиал, клен, мербау, орех)"
2313,"М-189 (дуб радиал, клен, мербау)","паркет  М-189 (дуб радиал, клен, мербау)"
2315,"М-194 (дуб радиал, клен, мербау, орех)","паркет  М-194 (дуб радиал, клен, мербау, орех)"
2314,"М-174 (дуб стандарт, клен, ясень. мербау, орех)","паркет  М-174 (дуб стандарт, клен, ясень. мербау, орех)"
2316,"М-187 (дуб радиал, клен,  орех)","паркет  М-187 (дуб радиал, клен,  орех)"
2317,"М-183 (дуб радиал, клен, мербау, венге)","паркет  М-183 (дуб радиал, клен, мербау, венге)"
2318,"М-169 (дуб радиал, клен, мербау, венге)","паркет  М-169 (дуб радиал, клен, мербау, венге)"
2319,"М-190 (дуб радиал, клен,венге)","паркет  М-190 (дуб радиал, клен,венге)"
2320,"М-181(дуб радиал, клен, орех)","паркет  М-181(дуб радиал, клен, орех)"
2321,"М-168 (дуб радиал, клен, мербау)","паркет  М-168 (дуб радиал, клен, мербау)"
2322,"М-192 (дуб радиал, клен, мербау, орех)","паркет  М-192 (дуб радиал, клен, мербау, орех)"
2323,"М-185 (дуб радиал, клен, венге)","паркет  М-185 (дуб радиал, клен, венге)"
2326,"М-120 дуб радиал, клен, мербау","паркет  М-120 дуб радиал, клен, мербау"
2328,"М-90 дуб радиал, мербау","паркет  М-90 дуб радиал, мербау"
2325,"М-119 дуб радиал, ясень, мербау","паркет  М-119 дуб радиал, ясень, мербау"
2324,"М-179 (дуб радиал, ясень, груша, орех)","паркет  М-179 (дуб радиал, ясень, груша, орех)"
2327,"М-107  дуб радиал, клен, ясень, мербау","паркет  М-107  дуб радиал, клен, ясень, мербау"
2329,"М-99  дуб радиал, клен, мербау","паркет  М-99  дуб радиал, клен, мербау"
2330,"М-96 дуб радиал, ясень, мербау, орех","паркет  М-96 дуб радиал, ясень, мербау, орех"
2331,"М-98  дуб радиал, орех, венге","паркет  М-98  дуб радиал, орех, венге"
2332,"М-118 дуб радиал, клен, орех","паркет  М-118 дуб радиал, клен, орех"
2333,"М-117  дуб радиал, клен, венге","паркет  М-117  дуб радиал, клен, венге"
2334,"М-82  дуб радиал, клен, ясень,орех","паркет  М-82  дуб радиал, клен, ясень,орех"
2335,"М-97  дуб радиал, клен, орех","паркет  М-97  дуб радиал, клен, орех"
2336,"М-106  дуб радиал, клен, ясень, мербау","паркет  М-106  дуб радиал, клен, ясень, мербау"
2337,"М-91 дуб радиал, ясень","паркет  М-91 дуб радиал, ясень"
2338,"М-89  дуб радиал, клен, орех","паркет  М-89  дуб радиал, клен, орех"
2339,"М-121дуб радиал, клен, орех, венге","паркет  М-121дуб радиал, клен, орех, венге"
2340,"М-80 дуб радиал, клен, орех","паркет  М-80 дуб радиал, клен, орех"
2341,"М-100  дуб радиал, клен, орех","паркет  М-100  дуб радиал, клен, орех"
2342,"М-101  дуб радиал, клен, венге","паркет  М-101  дуб радиал, клен, венге"
2343,"М-116  дуб радиал, клен, орех","паркет  М-116  дуб радиал, клен, орех"
2344,"M-74(дуб радиал, ясень, мербау)","паркет  M-74(дуб радиал, ясень, мербау)"
2345,"M-64 (дуб радиал, ясень)","паркет  M-64 (дуб радиал, ясень)"
2346,"M-75 ((дуб радиал, мербау)","паркет  M-75 ((дуб радиал, мербау)"
2347,"M-65(дуб радиал,клен, мербау)","паркет  M-65(дуб радиал,клен, мербау)"
2348,"M-78 (дуб радиал,клен, мербау)","паркет  M-78 (дуб радиал,клен, мербау)"
2350,"M-67 (дуб радиал, клен, мербау)","паркет  M-67 (дуб радиал, клен, мербау)"
2349,"M-68 (дуб радиал, орех)","паркет  M-68 (дуб радиал, орех)"
2351,"M-77 (дуб радиал, мербау)","паркет  M-77 (дуб радиал, мербау)"
2352,"M-62 (дуб радиал, орех)","паркет  M-62 (дуб радиал, орех)"
2353,"M-63 (дуб радиал, орех)","паркет  M-63 (дуб радиал, орех)"
2355,"M-61 (дуб радиал, орех)","паркет  M-61 (дуб радиал, орех)"
2354,"M-71 (дуб радиал, клен, орех)","паркет  M-71 (дуб радиал, клен, орех)"
2356,"M-66 (дуб радиал,клен, мербау)","паркет  M-66 (дуб радиал,клен, мербау)"
2358,"M-217 (дуб радиал, клен,ясень, орех)","паркет  M-217 (дуб радиал, клен,ясень, орех)"
2357,"M-73 (дуб радиал, орех)","паркет  M-73 (дуб радиал, орех)"
2359,"M-220 (дуб радиал, клен, ясень, орех)","паркет  M-220 (дуб радиал, клен, ясень, орех)"
2360,"M-216 (дуб радиал, клен, орех)","паркет  M-216 (дуб радиал, клен, орех)"
2361,"M-223 (клен, ярра, орех)","паркет  M-223 (клен, ярра, орех)"
2362,"M-222 (дуб радиал, клен, орех)","паркет  M-222 (дуб радиал, клен, орех)"
2363,"M-118 (дуб радиал, клен, орех)","паркет  M-118 (дуб радиал, клен, орех)"
2364,"M-117 (дуб радиал, клен, венге)","паркет  M-117 (дуб радиал, клен, венге)"
2365,"M-121 (дуб радиал, клен, орех, венге)","паркет  M-121 (дуб радиал, клен, орех, венге)"
2366,"M-167 (ясень, мербау, венге)","паркет  M-167 (ясень, мербау, венге)"
2367,"M-116 (дуб радиал, клен, орех)","паркет  M-116 (дуб радиал, клен, орех)"
2368,"M-147  ( дуб радиал, клен, мербау, венге)","паркет  M-147  ( дуб радиал, клен, мербау, венге)"
2369,"М-111 (дуб радиал, клен, мербау)","паркет  М-111 (дуб радиал, клен, мербау)"
2370,"M-115 (дуб радиал, клен, орех)","паркет  M-115 (дуб радиал, клен, орех)"
2371,"M-137 (дуб радиал, клен, орех)","паркет  M-137 (дуб радиал, клен, орех)"
2372,"M-140  ( дуб стандарт, дуб радиал, клен, орех)","паркет  M-140  ( дуб стандарт, дуб радиал, клен, орех)"
2373,"M-154 (дуб радиал, клен, орех)","паркет  M-154 (дуб радиал, клен, орех)"
2374,"М-112 (дуб радиал, клен, ясень, венге)","паркет  М-112 (дуб радиал, клен, ясень, венге)"
2375,"М-113 (дуб радирал, ясень, орех)","паркет  М-113 (дуб радирал, ясень, орех)"
2376,"M-127 (дуб радиал, клен, орех)","паркет  M-127 (дуб радиал, клен, орех)"
2377,"M-156 (дуб радиал, клен, мербау, орех)","паркет  M-156 (дуб радиал, клен, мербау, орех)"
2378,"M-157 (дуб радиал, клен, орех)","паркет  M-157 (дуб радиал, клен, орех)"
2380,"M-144 (клен, ясень, мербау)","паркет  M-144 (клен, ясень, мербау)"
2379,"M-160 (дуб радиал, клен, мербау, орех)","паркет  M-160 (дуб радиал, клен, мербау, орех)"
2381,"М-114(дуб радиал, клен, орех, венге)","паркет  М-114(дуб радиал, клен, орех, венге)"
2382,"M-43 дуб радиал, орех","паркет  M-43 дуб радиал, орех"
2383,"M-48 дуб радиал, клен, ясень, мербау","паркет  M-48 дуб радиал, клен, ясень, мербау"
2385,"M-57 ясень, мербау","паркет  M-57 ясень, мербау"
2384,"M-54 дуб радиал,  орех","паркет  M-54 дуб радиал,  орех"
2386,"M-42 дуб радиал, орех","паркет  M-42 дуб радиал, орех"
2387,"M-56 дуб радиал, ясень, орех","паркет  M-56 дуб радиал, ясень, орех"
2389,"M-60 дуб радиал, клен, орех","паркет  M-60 дуб радиал, клен, орех"
2388,"M-55 дуб радиал, мербау, орех","паркет  M-55 дуб радиал, мербау, орех"
2390,"M-49 дуб радиал, клен, орех","паркет  M-49 дуб радиал, клен, орех"
2391,"M-52 дуб радиал, дуб стандарт, ясень, венге","паркет  M-52 дуб радиал, дуб стандарт, ясень, венге"
2392,"M-53 клен, орех","паркет  M-53 клен, орех"
2393,"M-50 дуб радиал, клен, орех, ясень","паркет  M-50 дуб радиал, клен, орех, ясень"
2394,"M-58 карельская ьереза, орех","паркет  M-58 карельская ьереза, орех"
2395,"M-224 (дуб радиал, клен, мербау)","паркет  M-224 (дуб радиал, клен, мербау)"
2396,"M-231 (клен, ясень, платан, груша, мербау)","паркет  M-231 (клен, ясень, платан, груша, мербау)"
2397,"M-235 (дуб радиал, клен, груша, орех)","паркет  M-235 (дуб радиал, клен, груша, орех)"
2398,"M-229 (клен, груша, орех)","паркет  M-229 (клен, груша, орех)"
2399,"M-230 (клен, груша, мербау, венге)","паркет  M-230 (клен, груша, мербау, венге)"
2400,"M-233 (дуб радиал, клен, ясень, мербау, орех)","паркет  M-233 (дуб радиал, клен, ясень, мербау, орех)"
2401,"M-225  (дуб радиал, клен, орех, венге)","паркет  M-225  (дуб радиал, клен, орех, венге)"
2402,"Экзотический Эбен лунный","паркет Экзотический Эбен лунный"
2405,"Экзотический Палисандр","паркет Экзотический Палисандр"
2404,"Вишня Вишня селект","паркет Вишня Вишня селект"
2407,"Орех Орех Европейский пропаренный Прима","паркет Орех Орех Европейский пропаренный Прима"
2409,"Экзотический Королевское дерево (Лаосский Орех)","паркет Экзотический Королевское дерево (Лаосский Орех)"
2411,"Экзотический Пальма","паркет Экзотический Пальма"
2412,"Экзотический ТИК под лаком","паркет Экзотический ТИК под лаком"
2413,"Экзотический Пуинкадо (Май Денг)","паркет Экзотический Пуинкадо (Май Денг)"
2416,"Экзотический Эбен пламенный","паркет Экзотический Эбен пламенный"
2415,"Экзотический Кап, корень Падука","паркет Экзотический Кап, корень Падука"
2419,"Дуб натуральный, планка (L0601-01824)","Pergo Дуб натуральный, планка (L0601-01824)"
2414,"Экзотический Вишня американская","паркет Экзотический Вишня американская"
2420,"Дуб серый, планка (L0601-01730)","Pergo Дуб серый, планка (L0601-01730)"
2418,"Дуб натуральный, 3-х полосный (L0601-01819)","Pergo Дуб натуральный, 3-х полосный (L0601-01819)"
2421,"Дуб Белый EI 470 B","Witex Дуб Белый EI 470 B"
2422,"Дуб Альмерия EI 730 B","Witex Дуб Альмерия EI 730 B"
2423,"Дуб Лабрадор EI 840 B","Witex Дуб Лабрадор EI 840 B"
2425,"Клён деревенский AH 180 B","Witex Клён деревенский AH 180 B"
2424,"Сосна Деревенская PI 240 B","Witex Сосна Деревенская PI 240 B"
2426,"Яблоня Мазуры AP 120 B","Witex Яблоня Мазуры AP 120 B"
2427,"Яблоня Маркант AP 130 B","Witex Яблоня Маркант AP 130 B"
2428,"Дуб Испанский EI 910 B","Witex Дуб Испанский EI 910 B"
2429,"Ольха Романтическая ER 110 B","Witex Ольха Романтическая ER 110 B"
2430,"Вишня Фламандская KB 100 B","Witex Вишня Фламандская KB 100 B"
2432,"Трикотаж 1 - 300","Progress Трикотаж 1 - 300"
2431,"Вишня Тропическая KB 140 B","Witex Вишня Тропическая KB 140 B"
2433,"Трикотаж 2 - 301","Progress Трикотаж 2 - 301"
2434,"Трикотаж 3 - 302","Progress Трикотаж 3 - 302"
2435,"Трикотаж 4 - 303","Progress Трикотаж 4 - 303"
2436,"Трикотаж 5 - 304","Progress Трикотаж 5 - 304"
2437,"Трикотаж 6 - 305","Progress Трикотаж 6 - 305"
2438,"Трикотаж 7 - 306","Progress Трикотаж 7 - 306"
2439,"Трикотаж 8 - 307","Progress Трикотаж 8 - 307"
2440,"Трикотаж 9 - 308","Progress Трикотаж 9 - 308"
2442,"Elesgo Дуб летний","HDM Elesgo Дуб летний"
2441,"Трикотаж 10 - 309","Progress Трикотаж 10 - 309"
2443,"Elesgo Дуб крепостной","HDM Elesgo Дуб крепостной"
2444,"Elesgo Дуб мореный","HDM Elesgo Дуб мореный"
2445,"Elesgo Венге","HDM Elesgo Венге"
2447,"Elesgo Дуб серебряный","HDM Elesgo Дуб серебряный"
2448,"Elesgo Дуб рурский","HDM Elesgo Дуб рурский"
2449,"Elesgo Дуб табак","HDM Elesgo Дуб табак"
2450,"Elesgo Дуб нордик","HDM Elesgo Дуб нордик"
2451,"Elesgo Дуб ориент","HDM Elesgo Дуб ориент"
2452,"Elesgo Дуб крепостной","HDM Elesgo Дуб крепостной"
2453,"Elesgo Дуб рурский","HDM Elesgo Дуб рурский"
2454,"Elesgo Дуб табак","HDM Elesgo Дуб табак"
2455,"Elesgo Дуб ориент","HDM Elesgo Дуб ориент"
2456,"Elesgo Дуб нордик","HDM Elesgo Дуб нордик"
